{
  "schemaVersion": "star-cluster-tl1-integrated-tactical-combat-v2",
  "id": "tl1-itc07-35-space-track-aware-movement-acquisition",
  "baselineSha256": "cff1b6caca7eb4d32d08a140fba3c645d98c1275ef13b4185f830dccfbd49d19",
  "masterSeed": 640100,
  "trialsPerVariant": 10000,
  "technologyProfileCatalog": "src/StarCluster.ScenarioRunner/Scenarios/ArchitectureTechnology/tl1-tl2-standard-runtime-profiles-v0_3.json",
  "auxiliaryProfileCatalog": "src/StarCluster.ScenarioRunner/Scenarios/ArchitectureTechnology/tl1-tl2-auxiliary-runtime-profiles-v0_3.json",
  "builds": [
    {
      "id": "balanced_generalist_major",
      "mainWeaponCount": 1,
      "mainReactorCount": 1,
      "activeSensor": true,
      "shieldGenerator": true,
      "kineticPdsCount": 1,
      "usedSpace": 33,
      "freeSupportSpace": 2
    },
    {
      "id": "dual_main_striker_major",
      "mainWeaponCount": 2,
      "mainReactorCount": 1,
      "activeSensor": true,
      "shieldGenerator": false,
      "kineticPdsCount": 0,
      "usedSpace": 34,
      "freeSupportSpace": 1
    },
    {
      "id": "dual_reactor_power_core",
      "mainWeaponCount": 1,
      "mainReactorCount": 2,
      "activeSensor": true,
      "shieldGenerator": false,
      "kineticPdsCount": 0,
      "usedSpace": 34,
      "freeSupportSpace": 1
    },
    {
      "id": "pds_saturator",
      "mainWeaponCount": 1,
      "mainReactorCount": 1,
      "activeSensor": false,
      "shieldGenerator": false,
      "kineticPdsCount": 5,
      "usedSpace": 35,
      "freeSupportSpace": 0
    },
    {
      "id": "dual_main_dual_pds",
      "mainWeaponCount": 2,
      "mainReactorCount": 1,
      "activeSensor": false,
      "shieldGenerator": false,
      "kineticPdsCount": 2,
      "usedSpace": 35,
      "freeSupportSpace": 0
    },
    {
      "id": "shielded_pds_fortress",
      "mainWeaponCount": 1,
      "mainReactorCount": 1,
      "activeSensor": false,
      "shieldGenerator": true,
      "kineticPdsCount": 3,
      "usedSpace": 34,
      "freeSupportSpace": 1
    }
  ],
  "variants": [
    {
      "id": "c64-balanced-generalist-major-k-ef",
      "comparisonGroup": "c64-balanced-generalist-major-k",
      "profileLabel": "established-firm-control",
      "sideABuildId": "balanced_generalist_major",
      "sideBBuildId": "balanced_generalist_major",
      "sideAProfileId": "tl1-production",
      "sideBProfileId": "tl1-production",
      "sideAAuxiliaryProfileId": "aux-r53-none-tl1",
      "sideBAuxiliaryProfileId": "aux-r53-none-tl1",
      "sideAFamily": "Kinetic",
      "sideBFamily": "Missile",
      "movementMode": "OpponentAwareRange",
      "initialRangeHexes": 4,
      "protectedCompartmentation": false,
      "damageControl": "ComponentFirstReserveOne",
      "baseShieldRechargeEnabled": true,
      "evasiveManeuversEnabled": false,
      "pdsEnabled": true,
      "escapeDisengagementEnabled": false,
      "sideABackgroundTacticalPowerCommitment": 0,
      "sideBBackgroundTacticalPowerCommitment": 0,
      "sideATacticalPowerDoctrine": "FullVolleyFirst",
      "sideBTacticalPowerDoctrine": "FullVolleyFirst",
      "sideAReactorOutputOverride": 5,
      "sideBReactorOutputOverride": 5,
      "sideATrackPolicy": "EstablishedFirm",
      "sideBTrackPolicy": "EstablishedFirm",
      "sideANetEwRangePenalty": 0,
      "sideBNetEwRangePenalty": 0
    },
    {
      "id": "c64-balanced-generalist-major-k-lac",
      "comparisonGroup": "c64-balanced-generalist-major-k",
      "profileLabel": "legacy-auto-active-clear",
      "sideABuildId": "balanced_generalist_major",
      "sideBBuildId": "balanced_generalist_major",
      "sideAProfileId": "tl1-production",
      "sideBProfileId": "tl1-production",
      "sideAAuxiliaryProfileId": "aux-r53-none-tl1",
      "sideBAuxiliaryProfileId": "aux-r53-none-tl1",
      "sideAFamily": "Kinetic",
      "sideBFamily": "Missile",
      "movementMode": "OpponentAwareRange",
      "initialRangeHexes": 4,
      "protectedCompartmentation": false,
      "damageControl": "ComponentFirstReserveOne",
      "baseShieldRechargeEnabled": true,
      "evasiveManeuversEnabled": false,
      "pdsEnabled": true,
      "escapeDisengagementEnabled": false,
      "sideABackgroundTacticalPowerCommitment": 0,
      "sideBBackgroundTacticalPowerCommitment": 0,
      "sideATacticalPowerDoctrine": "FullVolleyFirst",
      "sideBTacticalPowerDoctrine": "FullVolleyFirst",
      "sideAReactorOutputOverride": 5,
      "sideBReactorOutputOverride": 5,
      "sideATrackPolicy": "AutoActive",
      "sideBTrackPolicy": "EstablishedFirm",
      "sideANetEwRangePenalty": 0,
      "sideBNetEwRangePenalty": 0
    },
    {
      "id": "c64-balanced-generalist-major-k-tac",
      "comparisonGroup": "c64-balanced-generalist-major-k",
      "profileLabel": "track-aware-auto-active-clear",
      "sideABuildId": "balanced_generalist_major",
      "sideBBuildId": "balanced_generalist_major",
      "sideAProfileId": "tl1-production",
      "sideBProfileId": "tl1-production",
      "sideAAuxiliaryProfileId": "aux-r53-none-tl1",
      "sideBAuxiliaryProfileId": "aux-r53-none-tl1",
      "sideAFamily": "Kinetic",
      "sideBFamily": "Missile",
      "movementMode": "TrackAwareOpponentRange",
      "initialRangeHexes": 4,
      "protectedCompartmentation": false,
      "damageControl": "ComponentFirstReserveOne",
      "baseShieldRechargeEnabled": true,
      "evasiveManeuversEnabled": false,
      "pdsEnabled": true,
      "escapeDisengagementEnabled": false,
      "sideABackgroundTacticalPowerCommitment": 0,
      "sideBBackgroundTacticalPowerCommitment": 0,
      "sideATacticalPowerDoctrine": "FullVolleyFirst",
      "sideBTacticalPowerDoctrine": "FullVolleyFirst",
      "sideAReactorOutputOverride": 5,
      "sideBReactorOutputOverride": 5,
      "sideATrackPolicy": "AcquisitionFirstAutoActive",
      "sideBTrackPolicy": "EstablishedFirm",
      "sideANetEwRangePenalty": 0,
      "sideBNetEwRangePenalty": 0
    },
    {
      "id": "c64-balanced-generalist-major-k-lew1",
      "comparisonGroup": "c64-balanced-generalist-major-k",
      "profileLabel": "legacy-auto-active-ew1",
      "sideABuildId": "balanced_generalist_major",
      "sideBBuildId": "balanced_generalist_major",
      "sideAProfileId": "tl1-production",
      "sideBProfileId": "tl1-production",
      "sideAAuxiliaryProfileId": "aux-r53-none-tl1",
      "sideBAuxiliaryProfileId": "aux-r53-none-tl1",
      "sideAFamily": "Kinetic",
      "sideBFamily": "Missile",
      "movementMode": "OpponentAwareRange",
      "initialRangeHexes": 4,
      "protectedCompartmentation": false,
      "damageControl": "ComponentFirstReserveOne",
      "baseShieldRechargeEnabled": true,
      "evasiveManeuversEnabled": false,
      "pdsEnabled": true,
      "escapeDisengagementEnabled": false,
      "sideABackgroundTacticalPowerCommitment": 0,
      "sideBBackgroundTacticalPowerCommitment": 0,
      "sideATacticalPowerDoctrine": "FullVolleyFirst",
      "sideBTacticalPowerDoctrine": "FullVolleyFirst",
      "sideAReactorOutputOverride": 5,
      "sideBReactorOutputOverride": 5,
      "sideATrackPolicy": "AutoActive",
      "sideBTrackPolicy": "EstablishedFirm",
      "sideANetEwRangePenalty": 1,
      "sideBNetEwRangePenalty": 0
    },
    {
      "id": "c64-balanced-generalist-major-k-tew1",
      "comparisonGroup": "c64-balanced-generalist-major-k",
      "profileLabel": "track-aware-auto-active-ew1",
      "sideABuildId": "balanced_generalist_major",
      "sideBBuildId": "balanced_generalist_major",
      "sideAProfileId": "tl1-production",
      "sideBProfileId": "tl1-production",
      "sideAAuxiliaryProfileId": "aux-r53-none-tl1",
      "sideBAuxiliaryProfileId": "aux-r53-none-tl1",
      "sideAFamily": "Kinetic",
      "sideBFamily": "Missile",
      "movementMode": "TrackAwareOpponentRange",
      "initialRangeHexes": 4,
      "protectedCompartmentation": false,
      "damageControl": "ComponentFirstReserveOne",
      "baseShieldRechargeEnabled": true,
      "evasiveManeuversEnabled": false,
      "pdsEnabled": true,
      "escapeDisengagementEnabled": false,
      "sideABackgroundTacticalPowerCommitment": 0,
      "sideBBackgroundTacticalPowerCommitment": 0,
      "sideATacticalPowerDoctrine": "FullVolleyFirst",
      "sideBTacticalPowerDoctrine": "FullVolleyFirst",
      "sideAReactorOutputOverride": 5,
      "sideBReactorOutputOverride": 5,
      "sideATrackPolicy": "AcquisitionFirstAutoActive",
      "sideBTrackPolicy": "EstablishedFirm",
      "sideANetEwRangePenalty": 1,
      "sideBNetEwRangePenalty": 0
    },
    {
      "id": "c64-balanced-generalist-major-e-ef",
      "comparisonGroup": "c64-balanced-generalist-major-e",
      "profileLabel": "established-firm-control",
      "sideABuildId": "balanced_generalist_major",
      "sideBBuildId": "balanced_generalist_major",
      "sideAProfileId": "tl1-production",
      "sideBProfileId": "tl1-production",
      "sideAAuxiliaryProfileId": "aux-r53-none-tl1",
      "sideBAuxiliaryProfileId": "aux-r53-none-tl1",
      "sideAFamily": "Energy",
      "sideBFamily": "Missile",
      "movementMode": "OpponentAwareRange",
      "initialRangeHexes": 4,
      "protectedCompartmentation": false,
      "damageControl": "ComponentFirstReserveOne",
      "baseShieldRechargeEnabled": true,
      "evasiveManeuversEnabled": false,
      "pdsEnabled": true,
      "escapeDisengagementEnabled": false,
      "sideABackgroundTacticalPowerCommitment": 0,
      "sideBBackgroundTacticalPowerCommitment": 0,
      "sideATacticalPowerDoctrine": "FullVolleyFirst",
      "sideBTacticalPowerDoctrine": "FullVolleyFirst",
      "sideAReactorOutputOverride": 5,
      "sideBReactorOutputOverride": 5,
      "sideATrackPolicy": "EstablishedFirm",
      "sideBTrackPolicy": "EstablishedFirm",
      "sideANetEwRangePenalty": 0,
      "sideBNetEwRangePenalty": 0
    },
    {
      "id": "c64-balanced-generalist-major-e-lac",
      "comparisonGroup": "c64-balanced-generalist-major-e",